{
  "dpp": "0.1",
  "typ": "capability",
  "iss": "did:key:z6MkuserExampleGrantor",
  "sub": "did:key:z6MkagentExampleHolder",
  "aud": ["merchant:checkout.example"],
  "exp": 1893456000,
  "nbf": 1715702400,
  "nonce": "7f3c9a2e-4b1d-4c8e-9f0a-1d2e3f4a5b6c",
  "scopes": [
    "pay:initiate",
    "pay:merchant:checkout.example"
  ],
  "constraints": {
    "maxAmount": {
      "value": "500.00",
      "currency": "INR"
    },
    "merchantAllowlist": [
      "merchant:checkout.example"
    ],
    "paymentMethods": ["upi", "card"],
    "requiresOtp": true
  },
  "delegation": {
    "depth": 0,
    "mayDelegate": false
  }
}
