{
  "dpp": "0.1",
  "typ": "capability",
  "iss": "did:key:z6MkagentExampleHolder",
  "sub": "did:key:z6MksubAgentWorker",
  "exp": 1893456000,
  "nonce": "sub-agent-run-20260515-001",
  "scopes": [
    "pay:initiate",
    "pay:merchant:checkout.example"
  ],
  "constraints": {
    "maxAmount": {
      "value": "100.00",
      "currency": "INR"
    },
    "merchantAllowlist": [
      "merchant:checkout.example"
    ],
    "requiresOtp": false
  },
  "delegation": {
    "parentJti": "7f3c9a2e-4b1d-4c8e-9f0a-1d2e3f4a5b6c",
    "depth": 1,
    "mayDelegate": false
  },
  "proof": {
    "type": "jws",
    "jws": "eyJhbGciOiJFUzI1NiIsInR5cCI6IkpXVCJ9.eyJkZHAiOiIwLjEifQ.signature-placeholder"
  }
}
